<?xml version="1.0" encoding="UTF-8"?>
<!DOCTYPE discografica_ext SYSTEM "discografica_ext.dtd">
<discografica>
  <disco>
    <titulo>El Viaje</titulo>
    <interpretes>
      <interprete>
        <nombre>Juan</nombre>
        <apellidos>Pérez Gómez</apellidos>
        <rol>Solista</rol>
      </interprete>
      <interprete>
        <nombre>Ana</nombre>
        <apellidos>López Ruiz</apellidos>
        <rol>Guitarrista</rol>
      </interprete>
    </interpretes>
    <num_pistas>2</num_pistas>
    <pistas>
      <pista>
        <nombre_cancion>Camino</nombre_cancion>
        <duracion>3:45</duracion>
      </pista>
      <pista>
        <nombre_cancion>Destino</nombre_cancion>
        <duracion>4:10</duracion>
      </pista>
    </pistas>
  </disco>
</discografica>